image,question
test_0308,What is caused by gonococcal infection?
test_0469,What is present ?
test_0964,What is present ?
test_0626,What are present?
test_0847,What has six digits ?
test_0439,What does this image show?
test_0023,What do the parenchymal changes include?
test_0458,What is close-up tumor well?
test_0597,What was in the stomach this is true bilateral krukenberg?
test_0390,What does this image show?
test_0297,What do renal tubules and glomeruli show?
test_0060,What does the scarred area show?
test_0843,What is well shown?
test_0979,How is atherosclerosis left anterior descending  artery ?
test_0965,What does this image show?
test_0544,What is other organs removed?
test_0586,Where does this part belong to?
test_0754,What does this image show?
test_0040,Are the pattern of staining of anti-centromere antibodies filled with a characteristic foamy acellular exudate?
test_0484,Where is this mage from?
test_0588,What is present?
test_0641,"Why does this image show squamous metaplasia, renal pelvis?"
test_0987,"What spotted fever , immunoperoxidase staining vessels for rickettsia rickettsii ?"
test_0542,What does this image show?
test_0066,What is the main mass multilobulated with?
test_0553,What does this image show?
test_0879,Where is this?
test_0580,What is present ?
test_0223,"What is removed at autopsy showing a unifocal,  massive neoplasm replacing most of the right hepatic lobe in a noncirrhotic liver?"
test_0976,What is present ?
test_0984,What is present ?
test_0492,What is present?
test_0471,What is present ?
test_0848,What is the best photo to illustrate this case externally ?
test_0957,What does this image show?
test_0676,What is present ?
test_0377,What is present?
test_0213,What is increased?
test_0503,What is present ?
test_0486,Where is this?
test_0170,What does the trabecular bone forming the marrow space show at the margins?
test_0752,What is present ?
test_0629,What does this image show?
test_0106,How does sectioned surface show lobulated mass?
test_0731,Where is this from?
test_0691,What is present ?
test_0509,What is present ?
test_0053,What is there of the nuclear chromatin which is eventually extruded from the cell at the late erythroblast stage?
test_0632,What does this image show?
test_0596,Where does this part belong to?
test_0497,What is present ?
test_0616,What are present ?
test_0282,Are the tubular epithelial cells distended with cytoplasmic vacuoles while the interstitial vasculature is compressed?
test_0675,What is present?
test_0307,What results in spherical contour and small size so as to contain the given volume of haemoglobin in the deformed red cell?
test_0295,What is a densely cellular tumor with necrosis and pseudo-palisading of tumor cell nuclei along the edge of the necrotic zone?
test_0461,What is present ?
test_0837,What is sure what it looks like?
test_0569,What is present ?
test_0945,What is present?
test_0657,What is present?
test_0874,What is present ?
test_0843,What is close-up of typical lesions perspective of elevated pasted on lesions shown?
test_0076,What shows characteristic lining of the cyst wall by epidermis and its appendages?
test_0860,Where is this from?
test_0701,What does this image show?
test_0262,What are the spores present in?
test_0460,What is present ?
test_0061,What are highlighted in this Warthin-Starry silver stain?
test_0107,What represents cell cycle for permanent cells?
test_0807,What does this image show?
test_0508,What does this image show?
test_0762,What does this image show?
test_0287,What does the cyst wall show?
test_0154,Where is the dead cell seen?
test_0974,What is present ?
test_0743,What is present?
test_0223,What replaced most of the right hepatic lobe in a noncirrhotic liver?
test_0037,Does high-power detail show minimal variation in nuclear size and occasional follicle formation?
test_0487,What does show lesion containing no lipid ?
test_0225,What do the nuclei show?
test_0860,How does this image show x-ray postmortcoronary arteries?
test_0240,One cusp has a partial fusion at whose center ?
test_0199,What are indicative of more severe liver cell injury?
test_0609,What does this image show?
test_0494,What is present ?
test_0834,What ecchymoses with necrotizing centers?
test_0877,Where is this?
test_0181,What is prominent hooding with?
test_0617,What does this image show?
test_0488,What does this image show?
test_0365,What does this image show?
test_0559,What does this image show?
test_0437,Where does this belong to?
test_0379,What is present?
test_0942,What is present ?
test_0762,Does abdomen show wrights typical plasma cells?
test_0561,What is present ?
test_0682,What is a thymus ?
test_0656,Where is this?
test_0175,"What is there of plasma cells, lymphocytes and macrophages?"
test_0581,What does this image show?
test_0225,How does the affected area on right show cells?
test_0867,Where is this?
test_0751,Where is this from?
test_0988,What is rocky mountain spotted?
test_0458,Does omphalocele show close-up tumor is shown well?
test_0750,"Does sickle cell disease show colon, regional enteritis?"
test_0621,What is present ?
test_0191,What produces a serrated architecture when glands are cut in cross-section?
test_0037,What shows minimal variation in nuclear size and occasional follicle formation?
test_0155,What shows regularly spaced stool-filled diverticulae?
test_0307,Do these end components of chromosome result in defect in anchoring of lipid bilayer of the membrane to the underlying cytoskeleton?
test_0497,What does this image show?
test_0479,What cut surface natural color yellow and white typical gross sarcoma?
test_0544,Where is this?
test_0217,What did subsynovial tissue contain?
test_0856,What does this image show?
test_0085,"Are the cells large, with round to convoluted nuclei having high n/c ratio and no cytoplasmic granularity?"
test_0898,What does this image show?
test_0100,What is causing reduction in lumen size?
test_0628,What is present ?
test_0574,What does this image show?
test_0204,Do the histone subunits allow for examination of individual axons of peripheral nerves?
test_0986,What is present ?
test_0613,What does this image show?
test_0617,What are present ?
test_0561,Where is this part in the figure?
test_0570,What is present?
test_0359,Where is this?
test_0446,What is present?
test_0876,What does this image show?
test_0654,"Why does this image show renal pelvis, squamous metaplasia?"
test_0060,What do the glomeruli show?
test_0528,What does this image show?
test_0478,What illustrates pus from the peritoneal cavity?
test_0560,What is present?
test_0989,What does this image show?
test_0417,What does this image show?
test_0650,What is present?
test_0576,What is present?
test_0690,What is present ?
test_0597,How is this true  krukenberg?
test_0729,What is present?
test_0225,What does the interface between viable and non-viable area show?
test_0910,What is present?
test_0454,What is present ?
test_0907,What does this image show?
test_0500,What is present ?
test_0910,What pale muscle?
test_0067,What does microscopy show?
test_0590,What does this image show?
test_0760,What is present?
test_0593,How is the excellent uterus in picture and thus illustrates the very  size of the ovarian tumor?
test_0123,What shows three layers in the wall of hydatid cyst?
test_0590,What is present ?
test_0441,What is present?
test_0105,What is the formation of viable new reactive bone surrounding the sequestrum called?
test_0009,What is a highly characteristic artifact of sectioning?
test_0274,"What is characterized by increased numbers of epithelial cells,  as in this example of epithelial hyperplasia?"
test_0160,"What was from a patient with ACTH-dependent Cushing syndrome,  in whom both adrenal glands were diffusely hyperplastic?"
test_0262,What are present in sporangia as well as are intermingled in the inflammatory cell infiltrate?
test_0834,Where is this?
test_0599,What is present?
test_0682,What does this image show?
test_0154,What has the nucleus clumped?
test_0740,Where is this from?
test_0574,What stain ?
test_0733,What is present ?
test_0160,What is contrasted with a normal adrenal gland?
test_0978,What is atherosclerosis left?
test_0837,What is correct diagnosis as i do not have protocol?
test_0806,What does this image show?
test_0900,Where is this?
test_0097,What is subacute endocarditis caused by?
test_0541,What is present?
test_0848,What is the best photo to illustrate this case externally?
test_0811,What is present?
test_0247,"What is a diagnostic,  binucleate Reed-Sternberg cell surrounded by?"
test_0584,What does this image show?
test_0204,What is a normal axon with a long thick dark myelin internode flanked by?
test_0384,What head showing mandibular lesion?
test_0741,Where is this from?
test_0060,Do the external surface of small intestine show periglomerular fibrosis?
test_0694,What does this image show?
test_0914,How does this image show vertebral column?
test_0901,What is present?
test_0199,What is seen as ballooning degeneration while acidophilic councilman bodies are indicative of more severe liver cell injury?
test_0907,What is present?
test_0628,What does this image show?
test_0979,What is present ?
test_0925,What is present ?
test_0971,Where is this from?
test_0106,What shows lobulated mass with bluish cartilaginous hue infiltrating the soft tissues?
test_0373,"What was talc used, alpha-1 antitrypsin deficiency?"
test_0065,"What is there increased in the red pulp, capsule and the trabeculae?"
test_0284,What do these tumors contain?
test_0458,What does this image show?
test_0611,What are too short?
test_0105,What does the abscess expand?
test_0577,What does this image show?
test_0732,What is present ?
test_0172,How is the liver?
test_0357,What does this image show?
test_0613,What is present?
test_0559,What is present ?
test_0893,What does this image show?
test_0659,What does this image show?
test_0568,What is present?
test_0493,What is present?
test_0359,What does this image show?
test_0497,What is present?
test_0211,What show birefringence?
test_0859,What is present ?
test_0503,What does this image show?
test_0539,Where is this?
test_0886,What is present ?
test_0847,What appear too short has six digits?
test_0173,What are thick with abundance of eosinophilic cytoplasm?
test_0510,Where does this belong to?
test_0308,How is acute epididymitis caused?
test_0156,What show irregularly scarred mitral valve leaving a fish-mouth or buttonhole opening between its two cusps?
test_0600,What is present?
test_0136,What are predominantly seen in lymph nodes and throughout lung parenchyma?
test_0062,What are lined by cuboidal to tall columnar and mucin-secreting tumour cells with papillary growth pattern?
test_0246,What is there?
test_0097,What is caused by Streptococcus viridans on a previously myxomatous mitral valve?
test_0077,Do the grades of CIN-1 or mild dysplasia show progressive increase in the number of abnormal cells parallel to the increasing severity of grades?
test_0873,What is present?
test_0658,Where is this?
test_0210,What is extensive in the space of Disse causing compression and pressure atrophy of hepatocytes?
test_0736,What is present?
test_0392,How is x-ray chest shown left hilar  tumor in hilar node ?
test_0764,What is present ?
test_0505,Where does this belong to?
test_0569,What does this image show?
test_0197,How many strictures does the lumen show?
test_0426,What is present?
test_0483,What does this image show?
test_0835,What ecchymoses with central necrosis?
test_0650,What does this image show?
test_0025,What is well-differentiated adenocarcinoma showing closely packed glands with cytologic atypia?
test_0684,What is present?
test_0163,What is contrasted with normal basal polarity in columnar epithelium?
test_0112,What were grossly hemorrhagic and shrunken at autopsy?
test_0641,Where is this?
test_0448,Where does this belong to?
test_0130,How does microscopic view of breast carcinoma illustrate the invasion of breast stroma and fat?
test_0233,What shows healed granulomas?
test_0242,What shows a grey white firm tumour extending irregularly into adjacent breast parenchyma?
test_0567,What is present?
test_0637,What does this image show?
test_0861,Where is this from?
test_0284,"Do acute epididymitis contain amyloid,  visible here as homogeneous extracellular material,  derived from calcitonin molecules secreted by the neoplastic cells?"
test_0695,Where is this?
test_0118,How are the commissures stenosis?
test_0979,What is atherosclerosis left?
test_0489,Where is this?
test_0601,What is present?
test_0009,What is composed of nests of basaloid cells infiltrating a fibrotic stroma?
test_0684,Where is this part in?
test_0525,What does this image show?
test_0316,What is markedly thickened?
test_0486,What does this image show?
test_0443,Where does this belong to?
test_0467,Where is this from?
test_0304,What contain abundant pink colloid within their lumina?
test_0656,What removed easily seen air bubbles?
test_0438,What is present?
test_0625,What are present ?
test_0169,What is there?
test_0940,What does this image show?
test_0958,What does this image show?
test_0576,Where is this part in the figure?
test_0594,What does this image show?
test_0909,What does this image show?
test_0366,What is present?
test_0908,Do saggital section typical not know history but probably breast lesion?
test_0945,What is present ?
test_0578,What is present?
test_0437,What is present?
test_0576,What does this image show?
test_0869,What is present ?
test_0450,What is present?
test_0624,What is present ?
test_0428,What is present?
test_0838,What does this image show?
test_0437,What is present ?
test_0905,What does this image show?
test_0613,What are present?
test_0566,Where is this part in the figure?
test_0204,What shows a segment surrounded by a series of thinly myelinated internodes of uneven length flanked on both ends by normal thicker myelin internodes?
test_0214,What is not clear-cut?
test_0105,What does process begin as?
test_0463,Where is this from?
test_0373,"What was used to sclerose emphysematous lung, alpha-1 antitrypsin deficiency?"
test_0924,What does this image show?
test_0926,What is present?
test_0656,What is present?
test_0384,What is present?
test_0127,"What shows circumscribed, dark tan, haemorrhagic and necrotic tumour?"
test_0727,What is present ?
test_0986,What does this image show?
test_0099,"How is reversible injury considered to do if the injurious stimulus is not removed, by convention?"
test_0182,What does external surface show?
test_0598,What is present ?
test_0676,When does this image show external view of lacerations of capsule apparently done?
test_0461,What is present?
test_0901,What does this image show?
test_0483,What is present ?
test_0612,What is present?
test_0925,"How many antitrypsin does this image show liver, cirrhosis alpha-deficiency?"
test_0900,What does this image show?
test_0510,What does this image show?
test_0246,What is present in subepithelial and perimuscular layers?
test_0506,Where does this belong to?
test_0390,What is present ?
test_0686,Where is this part in?
test_0675,What is present ?
test_0154,What is there?
test_0191,How are the glands cut?
test_0838,Where is this?
test_0677,What is the superior vena cava invaded by?
test_0560,Where is this area in the body?
test_0565,What is present?
test_0582,Where is this part in the figure?
test_0480,How does opened muscle psoa  color large ovoid typical sarcoma ?
test_0482,What is present ?
test_0473,What does this image show?
test_0753,What stain many pleomorphic blast cells readily seen ?
test_0543,Where is this?
test_0065,What are dilated and congested?
test_0611,What is present?
test_0978,What does this image show?
test_0599,What does this image show?
test_0173,Are the myocardial muscle fibres thick with abundance of eosinophilic cytoplasm?
test_0287,What does cut surface show without papillae?
test_0916,What is present?
test_0542,Where is this?
test_0976,Where is this in?
test_0060,Does the wedge-shaped infarct show atrophy of some tubules and dilatation of others which contain colloid casts thyroidisation?
test_0689,What is present?
test_0429,Where is this?
test_0970,Where is this in?
test_0978,What is present?
test_0169,What does the basal layer show?
test_0638,What does this image show?
test_0854,What is present ?
test_0706,What does this image show?
test_0727,Do close-up of lesion stain?
test_0862,What is present?
test_0739,Where is this from?
test_0485,What is present ?
test_0478,Where is this area in the body?
test_0414,What does this image show?
test_0414,What is present?
test_0689,Where is this part in?
test_0602,Where does this part belong to?
test_0188,What are seen mainly in the glomerular capillary tuft?
test_0730,What is present?
test_0619,What is present ?
test_0306,What do well-defined nodules compress?
test_0438,Where does this belong to?
test_0575,What has outside adrenal capsule section?
test_0053,What does the cytoplasm contain?
test_0199,Are acidophilic councilman bodies indicative of more severe liver cell injury?
test_0841,What burn?
test_0422,What is present?
test_0231,What does p-component have?
test_0225,What are still maintained?
test_0455,What does this image show?
test_0891,Where is this?
test_0199,What are the predominant histologic changes?
test_0032,"Did a wide-eyed,  staring gaze,  caused by overactivity of the sympathetic nervous system,  show mostly small,  blue,  primitive-appearing tumor cells?"
test_0198,What are the histological features present?
test_0702,What does this image show?
test_0438,What does this image show?
test_0042,What is composed of granulation tissue overlaid by degraded blood?
test_0549,What is present?
test_0388,What is present?
test_0989,"What spotted fever , immunoperoxidase staining vessels for rickettsia rickettsii ?"
test_0059,What does rest of the kidney have?
test_0360,Where is this?
test_0586,What does this image show?
test_0288,What shows a circumferential bright pink area of necrosis with protein deposition and inflammation?
test_0905,How is sectioned femur lesion  end excellent example?
test_0060,Are the tubules surrounded by abundant fibrous tissue and chronic interstitial inflammatory reaction?
test_0640,What does this image show?
test_0105,"What does the extension of infection into the joint space, epiphysis and the skin produce?"
test_0365,What is present?
test_0831,Does spina bifida show close-up photo quite good?
test_0479,What does this image show?
test_0753,What stain many pleomorphic blast cells readily seen?
test_0210,Where the deposition is extensive causing compression and pressure atrophy of hepatocytes?
test_0363,What does this image show?
test_0743,What does this image show?
test_0382,What is present?
test_0884,What is present ?
test_0737,Where is this from?
test_0539,What is present?
test_0799,What does this image show?
test_0427,What is present?
test_0619,What are present?
test_0175,What is there in the media and adventitia?
test_0421,What does this image show?
test_0385,What is present ?
test_0847,What do a barely seen vascular mass extruding from occipital region of skull arms and legs appear?
test_0221,What is a bile duct undergoing degeneration entrapped in?
test_0575,What is present ?
test_0481,Where is this area in the body?
test_0591,Where does this part belong to?
test_0677,What is the superior vena cava invaded by ?
test_0987,"What spotted fever, immunoperoxidase staining vessels for rickettsia rickettsii?"
test_0965,What is present ?
test_0135,Do these nests correspond to extent of metabolic pathway followed ADH = alcohol dehydrogenase ; ALDH or ACDH = hepatic acetaldehyde dehydrogenase ; NAD = nicotinamide adenine dinucleotide ; NADH = reduced NAD?
test_0628,What are present ?
test_0460,What does this image show?
test_0884,What does this image show?
test_0760,What do stress induce?
test_0844,What removed shows size of organs quite well and renal facies?
test_0654,What does this image show?
test_0248,What shows the morphologic variant of RS cell seen more often in particular histologic type?
test_0874,Where is this?
test_0749,What does this image show?
test_0834,What does this image show?
test_0639,What does this image show?
test_0052,What is due to the presence of melanin?
test_0569,What is present?
test_0112,What result in acute adrenal insufficiency?
test_0916,How is large gluteal hematoma seen at  through the skin ?
test_0523,What does this image show?
test_0362,What does this image show?
test_0250,What has this condition been termed?
test_0596,What is present ?
test_0653,Where is this?
test_0479,How is nodular tumor cut surface natural color yellow and white typical  sarcoma ?
test_0453,What is present?
test_0755,What is present ?
test_0307,When do d lose their cell membrane further?
test_0297,What is there at the periphery of the infarct?
test_0619,What does this image show?
test_0494,Where is this mage from?
test_0608,How does this image show metastatic choriocarcinoma?
test_0760,How do stress induce involution in baby?
test_0623,What does this image show?
test_0063,What are seen surrounding respiratory bronchioles?
test_0100,What is presented incidentally in the right ventricle?
test_0488,Where is this?
test_0188,"What casts in the tubular lumina, and in the arterial wall producing luminal narrowing?"
test_0465,What is present ?
test_0450,Where does this belong to?
test_0453,Where does this belong to?
test_0154,What is seen in singles?
test_0748,How does this image show med alcian blue with apparently eosin counterstain enlarged villus?
test_0448,What does this image show?
test_0160,How is diffuse hyperplasia of the adrenal gland contrasted?
test_0447,Why does this image show cortical and medullary hemorrhage not extensive but clearly evident case of pneumococcal meningitis lesion probably?
test_0848,What is this to illustrate this case externally?
test_0009,What is the cleft between the tumor cells and the stroma?
test_0497,Where does this belong to?
test_0886,Where is this?
test_0676,What done done during surgical procedure ?
test_0085,"What are large, with round to convoluted nuclei having high n/c ratio and no cytoplasmic granularity?"
test_0880,Where is this?
test_0127,What is expanded in the region of epiphysis?
test_0148,What does typical tuberculous granuloma show?
test_0195,What does the granuloma in the center show?
test_0279,"What was present within this Wilms tumor,  characterized by cells with hyperchromatic,  pleomorphic nuclei,  and an abnormal mitosis center of field?"
test_0894,Where is this?
test_0745,What does this image show?
test_0749,Where is this from?
test_0059,"What shows irregular, circumscribed, yellowish mass with areas of haemorrhages and necrosis?"
test_0547,Where is this?
test_0282,What is compressed?
test_0911,What does this image show?
test_0736,"Does hemorrhage in newborn show oral dysplasia, neu?"
test_0575,Has cachexia folds?
test_0545,Where is this?
test_0191,What does epithelial crowding produce when glands are cut in cross-section?
test_0368,What does this image show?
test_0107,What is the inner circle shown with?
test_0730,What does this image show?
test_0759,What does this image show?
test_0754,What is present?
test_0284,"Do these tumors contain amyloid,  visible here as homogeneous extracellular material,  derived from calcitonin molecules secreted by the neoplastic cells?"
test_0622,What does this image show?
test_0573,What does this image show?
test_0380,What is present?
test_0358,Where is this?
test_0224,What is chematic mechanisms involved in?
test_0864,What is present ?
test_0894,What does this image show?
test_0882,What is present?
test_0438,What is present ?
test_0689,What is present ?
test_0752,What does this image show?
test_0973,What is present ?
test_0182,"What shows increased mesenteric fat, thickened wall and narrow lumen?"
test_0097,How is subacute endocarditis caused?
test_0356,What is present?
test_0730,What is present ?
test_0861,What postmortdissected arteries extensive lesions ?
test_0704,What does this image show?
test_0018,"Are the thickened alveolar walls infiltrated with lymphocytes and some plasma cells,  which spill over into alveolar spaces?"
test_0598,Where does this belong to?
test_0170,How does the trabecular bone forming the marrow space show trabeculae?
test_0480,How does opened muscle psoa natural color  ovoid typical sarcoma ?
test_0707,What stain?
test_0653,What does this image show?
test_0512,What does this image show?
test_0682,Where is this part in?
test_0522,What does this image show?
test_0099,"What is considered to culminate in necrosis if the injurious stimulus is not removed, by convention?"
test_0235,How are the tumor cells strikingly similar to normal squamous epithelial cells?
test_0490,Where is this area in the body?
test_0765,What does this image show?
test_0640,Where is this?
test_0741,What does this image show?
test_0870,What is present?
test_0607,How does this image appear  ?
test_0585,Where does this belong to?
test_0837,Where is this?
test_0875,What is present ?
test_0597,What is present ?
test_0502,What does this image show?
test_0847,What does lateral view of body with renal facies no neck and a barely seen vascular mass extruding from occipital region of skull arms and legs appear too short have?
test_0700,What is present?
test_0969,What is present?
test_0059,What shows a large and tan mass while rest of the kidney has reniform contour?
test_0257,What are illustrated?
test_0440,What is present?
