image,question
test_0486,Is lower chest and abdomen anterior present?
test_0741,Is pus in test tube present?
test_0766,Is blood present?
test_0650,Is urinary present?
test_0574,Does cachexia stain?
test_0683,Is spleen present?
test_0307,Does the wedge-shaped infarct result in spherical contour and small size so as to contain the given volume of haemoglobin in the deformed red cell?
test_0391,Is basilar skull fracture present?
test_0366,"Does ulcer with candida infection show lung, histoplasma pneumonia?"
test_0647,"Does this image show renal pelvis, squamous metaplasia due to chronic urolithiasis?"
test_0765,Is bone marrow present?
test_0471,Does this image show bizarre strap and fusiform cells?
test_0565,Is vessel present?
test_0808,Does this image show fixed tissue tumor masses with necrosis easily seen?
test_0568,Is endocrine present?
test_0554,"Does this image show skin, kaposi 's sarcoma?"
test_0673,Does this image show cat scan showing tumor mass invading superior vena ca?
test_0427,Is edema present?
test_0246,Is there subepithelial and subserosal fibrosis and hypertrophy of muscularis?
test_0681,Is spleen present?
test_0092,"Does sectioned surface show circumscribed, dark tan, haemorrhagic and necrotic tumour?"
test_0678,Is cardiovascular present?
test_0980,Is cardiovascular present?
test_0385,Is choanal atresia present?
test_0142,Is the gallbladder mucosa infiltrated by chronic inflammatory cells?
test_0478,Is tuberculous peritonitis present?
test_0694,Does this image show normal pancreas?
test_0557,Does this image show null cell dr garcia tumors 35?
test_0563,"Does photo show adrenal, polyarteritis nodosa with infarct?"
test_0285,Is the heart increased in the number of layers of epithelium?
test_0531,Is lymph node present?
test_0889,Does this image show migratory thrombophlebitis?
test_0737,Is stillborn macerated present?
test_0598,Is uterus present?
test_0596,Is benign cystic teratoma present?
test_0389,Does an opened peritoneal cavity cause by fibrous band strangulation show dr garcia tumors b4?
test_0045,Does a Masson trichrome preparation show complete replacement of virtually all glomeruli by blue-staining collagen?
test_0490,Is breast present?
test_0744,Does this image show typical infiltrating adenocarcinoma and normal mucosa?
test_0191,Does Movat produce a serrated architecture when glands are cut in cross-section?
test_0629,Is hand present?
test_0453,"Does this section showing liver with tumor mass in hilar area tumor show parathyroid, functional adenoma?"
test_0462,Does this image show normal breast?
test_0764,Is temporal muscle hemorrhage present?
test_0488,Does carcinomatosis show foam cell?
test_0372,"Was coronary artery anomalous origin left from pulmonary artery used to sclerose emphysematous lung, alpha-1 antitrypsin deficiency?"
test_0865,Does nodular tumor show coronary artery atherosclerosis?
test_0926,Does umbilical cord show normal liver?
test_0978,Does conjoined twins show atherosclerosis?
test_0730,Is papillary intraductal adenocarcinoma present?
test_0502,Is fibrinous peritonitis present?
test_0908,Does this image show saggital section typical do not know history but probably breast lesion?
test_0447,Is coronary artery anomalous origin left from pulmonary artery present?
test_0474,Is female reproductive present?
test_0007,Is a partly formed unerupted tooth also seen in the wall?
test_0595,Does chromophobe adenoma show opened lesion with necrotic center not too typical?
test_0468,"Does this image show cervix, squamous metaplasia?"
test_0845,Is leiomyosarcoma present?
test_0729,Is gastrointestinal present?
test_0872,"Does this image show abdominal aorta saccular aneurysm, atherosclerosis?"
test_0859,Is cardiovascular present?
test_0590,Is mixed mesodermal tumor present?
test_0745,Is intestine present?
test_0696,Does pneumocystis show pancreatic fat necrosis?
test_0361,Is spinal column present?
test_0128,"Does bilayer lipid membrane have inflammatory cell infiltrate, newly formed blood vessels and young fibrous tissue in loose matrix?"
test_0183,Is the cut surface no significant inflammation or fibrosis?
test_0573,Is heart present?
test_0866,Does newborn cord around neck show amyloidosis?
test_0596,Is female reproductive present?
test_0076,Are islands of mature cartilage also seen?
test_0528,Is metastatic carcinoma present?
test_0659,Does purulent sinusitis show rather close-up view of tumor cut surface?
test_0060,Does the scarred area show atrophy of some tubules and dilatation of others which contain colloid casts thyroidisation?
test_0014,"Is cell necrosis identified by homogeneous, eosinophilic cytoplasm?"
test_0511,Does atherosclerosis show esophageal varices due to alcoholic cirrhosis?
test_0620,Are cells present?
test_0600,Is female reproductive present?
test_0380,Is rheumatoid arthritis present?
test_0149,Is chematic representation of mechanisms surrounded by increased fat?
test_0971,Is marfans syndrome present?
test_0481,Is abdomen present?
test_0605,Is female reproductive present?
test_0682,Is this a thymus?
test_0495,Does atrophy show skeletal muscle?
test_0450,"Does this image show adrenal, pheochromocytoma?"
test_0611,Is foot present?
test_0887,"Does this image show skin, neurofibromatosis?"
test_0682,Is normal ovary present?
test_0421,Is coronary artery present?
test_0591,Is female reproductive present?
test_0989,Is newborn cord around neck present?
test_0608,Is metastatic Carcinoma present?
test_0848,Is this the best photo to illustrate this case externally?
test_0975,Is intraductal papillomatosis present?
test_0673,Does villous adenoma show cat scan showing tumor mass invading superior vena ca?
test_0938,Is angiogram saphenous vein bypass graft present?
test_0585,Does this image show external view typical appearance?
test_0268,Does the sectioned surface show dark tan firm areas with base on the pleura?
test_0986,Does newborn cord around neck show epithelial component resembling endometrium?
test_0617,Does granulomata slide show typical gangrene?
test_0572,Does this image show hashimoto 's thyroiditis?
test_0727,"Does endocrine show esohagus, candida?"
test_0489,Is cranial artery present?
test_0577,Is very good example present?
test_0892,Is fibrinous peritonitis present?
test_0454,Is Nodule present?
test_0050,Are abscesses present in the putamen and thalamus?
test_0363,"Does this image show lung, congestion, heart failure cells hemosiderin laden macrophages?"
test_0679,Is spleen present?
test_0225,Does the affected area on right show non-specific chronic inflammation and proliferating vessels?
test_0480,Is abdomen present?
test_0676,Is hematologic present?
test_0118,Are small nests of epithelial cells and myxoid stroma forming cartilage and bone heaped up within the sinuses of Valsalva?
test_0418,Does this image show Breast cancer metastasis to lung?
test_0615,Are trophic changes present?
test_0385,Is teeth present?
test_0045,Does there show complete replacement of virtually all glomeruli by blue-staining collagen?
test_0578,Is this typical lesion present?
test_0043,Are intraepithelial and lamina propria neutrophils prominent?
test_0574,Is Hemochromatosis present?
test_0964,Is vasculature present?
test_0311,Does the coarsely nodular gland contain areas of fibrosis and cystic change?
test_0582,Is aorta present?
test_0596,Is ovary present?
test_0606,"Does liver show breast, fibroadenoma?"
test_0242,Does the breast show a tumour extending up to nipple and areola?
test_0735,Does this image show organisms not appendix structures in photo?
test_0703,Is no cystic aortic lesions present?
test_0798,Does postpartum show acute pancreatitis?
test_0220,Is inflammatory cell infiltration marked at the line of demarcation between the infarcted and normal bowel?
test_0190,"Are bite cells similar to the one in this smear seen at this stage,  associated with regeneration and repair?"
test_0060,Are trophozoites of entamoeba histolytica included thick-walled?
test_0593,Is ovary present?
test_0506,"Does this image show esophagus, mallory-weiss tears?"
test_0596,Is fibrotic lesion present?
test_0833,Is antitrypsin present?
test_0053,Does the circle shown with red line contain progressively less rna and more haemoglobin?
test_0106,Does the amputated head of the long bone show lobulated mass with bluish cartilaginous hue infiltrating the soft tissues?
test_0480,Is retroperitoneal leiomyosarcoma present?
test_0677,Is hematologic present?
test_0376,Is lymphangiomatosis present?
test_0854,Is newborn Cord Around Neck present?
test_0153,Is a giant cell with inclusions also seen in the photomicrograph?
test_0903,"Does metastatic neuroblastoma show skin, petechial hemorrhages from patient with meningococcemia?"
test_0736,"Does this image show oral dysplasia, neu?"
test_0603,Is female reproductive present?
test_0989,Does this image show vasculitis?
test_0381,Does bicornate uterus show body on autopsy table lesion that supposedly predicts premature coronary disease is easily seen?
test_0151,"Is the aneurysmal bone cyst with blood-filled cystic space surrounded by a fibrous wall containing proliferating fibroblasts,  reactive woven bone,  and osteoclast-type giant cells?"
test_0593,Is female reproductive present?
test_0127,Is the end of the long bone expanded in the region of epiphysis?
test_0059,Does rest of the kidney have reniform contour?
test_0443,Does this image show adrenal phaeochromocytoma?
test_0231,Does p-component show fibrils having cross -- pleated sheet configuration which produces periodicity that gives the characteristic staining properties of amyloid with Congo red and birefringence under polarising microscopy?
test_0488,Is atrophy present?
test_0966,Is liver present?
test_0616,Are extremities present?
test_0732,Is foot present?
test_0176,Is Stanford type B limited to descending aorta?
test_0357,Is respiratory present?
test_0567,"Does this image show pituitary, chromaphobe adenoma?"
test_0987,"Is lateral view spotted fever, immunoperoxidase staining vessels for rickettsia rickettsii?"
test_0025,Are defects in any of the six well-differentiated adenocarcinoma showing closely packed glands with cytologic atypia?
test_0750,Is gastrointestinal present?
test_0865,Is chronic ischemia present?
test_0684,Is hematologic present?
test_0809,Is benign hyperplasia present?
test_0914,Does this image show vertebral column with well shown gross lesions?
test_0428,Is linear fracture in occiput present?
test_0482,Is metastatic carcinoma present?
test_0380,Is carcinomatosis endometrium primary present?
test_0988,Is lesion of myocytolysis present?
test_0454,Is cachexia present?
test_0525,Does marfans syndrome show typical area of caseous necrosis with nearby early granuloma quite good source unknown?
test_0023,"Do liver cells include sclerosed glomeruli, tubular atrophy and fine interstitial fibrosis?"
test_0975,Is vasculature present?
test_0927,Does this image show normal liver?
test_0864,Is cardiovascular present?
test_0470,Is leiomyosarcoma present?
test_0052,Is the dark color of the tumor nodules in this specimen due to the presence of melanin?
test_0173,Are these cells also enlarged with irregular outlines?
test_0460,Is conjoined twins present?
test_0510,"Does this image show intestine, leiomyoma?"
test_0439,"Does this image show pituitary, chromaphobe adenoma?"
test_0386,Does this image show very good example associated with tuberous sclerosis?
test_0508,"Does this image shows of smooth muscle cell with lipid in sarcoplasm and lipid show stomach and esophagus, ulcers?"
test_0613,Are extremities present?
test_0600,Is good example of muscle atrophy present?
test_0701,Does choanal atresia show normal pancreas?
test_0127,Is viral dna expanded in the region of epiphysis?
test_0748,Does this image show med alcian blue with apparently eosin counterstain enlarged villus with many macrophages source?
test_0175,"Is section from margin of amoebic ulcer perivascular infiltrate of plasma cells, lymphocytes and macrophages?"
test_0135,Does thickness and intensity of colour of arrows on left side of figure correspond to extent of metabolic pathway followed ADH = alcohol dehydrogenase ; ALDH or ACDH = hepatic acetaldehyde dehydrogenase ; NAD = nicotinamide adenine dinucleotide ; NADH = r
test_0465,Is female reproductive present?
test_0473,"Does this image show cervix, mild dysplasia?"
test_0755,Is opened uterus and cervix with large cervical myoma protruding into vagina slide present?
test_0442,Is amyloidosis present?
test_0217,Did confluent necrosis contain a dense lymphoid aggregate?
test_0218,Does microscopy show branching papillae having flbrovascular stalk covered by a single layer of cuboidal cells having ground-glass nuclei?
test_0446,Is endocrine present?
test_0686,Is breast present?
test_0387,Is purulent sinusitis present?
test_0149,Is matted mass of lymph nodes surrounded by increased fat?
test_0854,Is acute lymphocytic leukemia present?
test_0685,Is close-up excellent example of interosseous muscle atrophy present?
test_0072,"Did histologic view of the nodular stage demonstrate sheets of plump,  proliferating spindle cells and slitlike vascular spaces?"
test_0510,"Does chromophobe adenoma show intestine, leiomyoma?"
test_0191,Are previous episodes of rheumatic valvulitis cut in cross-section?
test_0067,Does the necrotic tissue show a well-differentiated tumour composed of spindle-shaped cells forming interlacing fascicles producing a typical Herring-bone pattern?
test_0609,Does leiomyosarcoma show excellent invasive tumor with marked desmoplastic reaction?
test_0982,Does this image show polyarteritis nodosa?
test_0122,"Did early (reversible) ischemic injury increase eosinophilia of cytoplasm,  and swelling of occasional cells?"
test_0308,Is the epididymis involved by an abscess?
test_0911,Is joints present?
test_0740,Does this image show typical infiltrating adenocarcinoma extending to serosal fat?
test_0060,Are the blood vessels included are thick-walled?
test_0857,Is skin over back a buttocks present?
test_0578,Is peritoneal fluid present?
test_0641,Is all the fat necrosis present?
test_0380,Is benign cystic teratoma present?
test_0763,Is hematologic present?
test_0740,Is gastrointestinal present?
test_0907,Does this image show opened body typical?
test_0891,Does supernumerary digit show scleroderma?
test_0638,Does this image show abortive glomeruli?
test_0118,Are nodular masses of calcium heaped up within the sinuses of Valsalva?
test_0463,Is natural color present?
test_0768,Is close-up excellent example of interosseous muscle atrophy present?
test_0932,Does this image show cholangiocarcinoma?
test_0594,Is uterus present?
test_0674,"Does view of head with scalp show sickle cell disease, spleen?"
test_0752,Are organisms easily evident?
test_0727,Is gastrointestinal present?
test_0568,Is adrenal present?
test_0445,Is this image shows of smooth muscle cell with lipid in sarcoplasm and lipid present?
test_0123,Does inbox in the right photomicrograph show a scolex with a row of hooklets?
test_0879,"Does cranial artery show heart, right coronary artery, atherosclerosis and acute thrombus?"
test_0389,"Is bone, calvarium present?"
test_0170,"Does the cortical bone forming the outer shell show concentric lamellae along with osteocytic lacunae surrounding central blood vessels, while the trabecular bone forming the marrow space shows trabeculae with osteoclastic activity at the margins?"
test_0976,"Does lesion of myocytolysis show heart, papillary muscle, fibrosis, chronic ischemic heart disease?"
test_0765,Does iron stain excellent example source unknown?
test_0486,Is cardiovascular present?
test_0683,Is hematologic present?
test_0513,"Does this image show pharyngeal pouch remnant, incidental finding in an adult?"
test_0651,Is cytomegalovirus present?
test_0377,Does this image show large nodular osteoma in right temporal fossa?
test_0454,Does this image show typical so-called cortical adenomas?
test_0741,Is gastrointestinal present?
test_0758,"Does this photo show spleen, chronic congestion due to portal hypertension from cirrhosis, hcv?"
test_0627,Is cachexia present?
test_0924,"Does bone, skull show liver, cirrhosis and enlarged gall bladder?"
test_0107,Does circle shown with yellow-orange line represent cell cycle for stable cells?
test_0136,Are the lesions predominantly seen in lymph nodes and throughout lung parenchyma?
test_0477,Is situs Inversus present?
test_0583,"Does parathyroid show uterus, leiomyomas?"
test_0466,"Does fibrinous peritonitis show uterus, leiomyomas?"
test_0847,Does this image show lateral view of body with renal facies no neck?
test_0768,Is ameloblastoma present?
test_0061,Are organisms abundant within surface mucus?
test_0567,"Does retroperitoneal leiomyosarcoma show pituitary, chromaphobe adenoma?"
test_0620,Are extremities present?
test_0233,Does the periphery show healed granulomas?
test_0307,Does this produce a circulating subpopulation of hyperspheroidal spherocytes while splenic macrophages in large numbers phagocytose defective red cells causing splenomegaly?
test_0116,Does the stratum corneum around the hair follicle show presence of numerous arthrospores and hyphae?
test_0066,Is the main mass multilobulated with increased fat while lower part of the image shows a separate encapsulated gelatinous mass?
test_0697,Does very good example show cystic fibrosis?
test_0752,Does this image show organisms are easily evident?
test_0616,Does this image show simian crease?
test_0105,Does photomicrograph on right under higher magnification begin as a focus of microabscess in a vascular loop in the marrow which expands to stimulate?
test_0458,Does this image show close-up tumor is shown well?
test_0860,Is cardiovascular present?
test_0036,Are the lipofuscin pigment granules also included?
test_0551,Is myocardium present?
test_0968,Is cranial artery present?
test_0737,"Does this image show leukoplakia, egf receptor?"
test_0391,Is nodule present?
test_0860,Is angiogram present?
test_0744,Is omentum present?
test_0457,Does granulomata slide show adrenal phaeochromocytoma?
test_0990,Is retroperitoneum present?
test_0607,Is peritoneum present?
test_0926,Is hepatobiliary present?
test_0870,"Does this image show heart, recent coronary artery bypass graft?"
test_0590,Does this image show opened uterus polypoid tumor demonstrated?
test_0954,Is testicle present?
test_0494,Is capillary present?
test_0392,Does this image show x-ray chest well shown left hilar mass tumor in hilar node?
test_0388,Is slide present?
test_0582,Is newborn cord around neck present?
test_0564,Is vasculature present?
test_0678,Is hematologic present?
test_0837,Is metastatic melanoma sure what it looks like?
test_0983,"Does beckwith-wiedemann syndrome show heart, acute myocardial infarction, he?"
test_0188,Are the amyloid deposits seen mainly in the glomerular capillary tuft?
test_0739,Is colon present?
test_0241,Do large clusters of fibers appear that all share the same fiber type (fiber type grouping)?
test_0990,Does this image show glioma?
test_0907,Is soft tissue present?
test_0250,Is this condition cystic hygroma?
test_0963,Is tuberculosis present?
test_0691,Is hematologic present?
test_0501,Is malignant lymphoma present?
test_0224,Is chematic mechanisms involved in pathogenesis of two main types of diabetes mellitus?
test_0438,Is an opened peritoneal cavity cause by fibrous band strangulation present?
test_0752,Is hematologic present?
test_0181,Is periodic acid-schiff shown on the right in this four-chamber view?
test_0369,Is respiratory present?
test_0630,Are extremities present?
test_0234,Does conventional chondrosarcoma entrap native lamellar bone as a confluent mass of cartilage?
test_0593,Is the excellent uterus in picture and thus illustrates the very large size of the ovarian tumor?
test_0231,Is Each fibril further composed of double helix of two pleated sheets in the form of twin filaments separated by a clear space?
test_0974,Is polycystic disease present?
test_0236,Are the vesselwall filled with blood clot?
test_0751,Is gastrointestinal present?
test_0957,Does this image show interstitial infiltrate well shown not the best morphology?
test_0901,Does this image show excellent showing lesion just beneath epidermis with pigmented and non-pigmented cells?
test_0862,Is vasculature present?
test_0855,Does this image show gram negative septicemia due to scalp electrode in a neonate?
test_0653,Does this image show pas-alcian blue?
test_0236,Does c result around 7th day result in scar tissue at the sites of incision and suture track?
test_0675,Does this image show splenic infarcts?
test_0482,Is subdiaphragmatic abscess present?
test_0765,Is sideroblasts present?
test_0275,"Are the periphery large number of malignant cells scattered singly or in small clusters having characteristic cytoplasmic vacuoles, nuclear hyperchromasia and prominent nucleoli?"
test_0565,Is endocrine present?
test_0588,Is female reproductive present?
test_0167,"Are the histone subunits positively charged,  thus allowing the compaction of the negatively charged DNA?"
test_0565,Does angiogram show parathyroid adenoma?
test_0932,Is hepatobiliary present?
test_0907,Is muscle present?
test_0076,Does mall show characteristic lining of the cyst wall by epidermis and its appendages?
test_0544,Is polycystic disease infant present?
test_0371,"Does pancreas show lung, multinucleated foreign body giant cell?"
test_0586,Is female reproductive present?
test_0478,Does case of peritonitis slide illustrate pus from the peritoneal cavity?
test_0698,Does saggital section typical show cystic fibrosis?
test_0866,Is cardiovascular present?
test_0882,Is this photo of infant from head to toe present?
test_0438,Does pituitary show fixed tissue nice close-up view of cortical nodules?
test_0274,"Is proliferative breast disease characterized by increased numbers of epithelial cells,  as in this example of epithelial hyperplasia?"
test_0966,"Does infant body show heart, polyarteritis nodosa?"
test_0465,Does nodule show normal ovary?
test_0895,Does chronic myelogenous leukemia show organism?
test_0706,"Does brain, cryptococcal meningitis, pas show pancreatic fat necrosis?"
test_0470,Is uterus present?
test_0382,"Is bone, calvarium present?"
test_0549,Does this image show single large lesion quite good?
test_0382,Does this image show close-up of linear fracture very well?
test_0454,Is adrenal present?
test_0367,Is respiratory present?
test_0900,Does this image show panniculitis and fascitis?
test_0465,Does this image show normal ovary?
test_0422,Does this image show normal lung?
test_0059,Does the upper pole of the kidney show a large and tan mass while rest of the kidney has reniform contour?
test_0762,Is bone marrow present?
test_0191,Are glands cut in cross-section?
test_0414,"Does this image show hilar lymph nodes, nodular sclerosing hodgkins disease and diffuse alveolar damage with hemorrhagic pneumonia?"
test_0627,Does this image show good example source of gout?
test_0495,Is subdiaphragmatic abscess present?
test_0973,Does retroperitoneal liposarcoma show saphenous vein graft sclerosis?
test_0372,"Was talc used to sclerose emphysematous lung, alpha-1 antitrypsin deficiency?"
test_0365,"Does neurofibrillary change show lung, infarct, acute and organized?"
test_0989,Does anencephaly show vasculitis?
test_0461,Does this image show section through thyroid and trachea apparently?
test_0596,Does lower chest and abdomen anterior show necrotic central mass with thin fibrous capsule not all that typical 91yo?
test_0373,"Was talc used to sclerose emphysematous lung, alpha-1 antitrypsin deficiency?"
test_0279,Are FISH using a fluorescein-labeled cosmid probe for n-myc on a tissue section containing neuroblastoma associated with specific molecular lesions?
test_0637,"Does this image show kidney, normal histology?"
test_0052,Are metastatic lesions distinguished grossly from most primary central nervous system tumors by their multicentricity and well-demarcated margins?
test_0175,Is thalassaemia and hbd endarteritis and periarteritis of the vasa vasorum in the media and adventitia?
test_0641,"Does this fixed tissue show squamous metaplasia, renal pelvis due to nephrolithiasis?"
test_0942,Is hepatobiliary present?
test_0256,"Did the cause of reversible injury show scattered inflammatory cells,  calcification arrowheads,  and neovascularization ?"
test_0220,Does the apex show coagulative necrosis and submucosal haemorrhages?
test_0730,Does cortical nodule show tunica propria granulomas?
test_0018,"Is a myofiber distended with trypanosomes infiltrated with lymphocytes and some plasma cells,  which are spilling over into alveolar spaces?"
test_0390,Does this image show close-up view of hemorrhagic excavation quite good?
test_0981,Is cardiovascular present?
test_0927,Is hepatobiliary present?
test_0837,Is toxic epidermal necrolysis present?
test_0309,Is classification of chromosomes base on size and location of centromere?
test_0968,Is cardiovascular present?
test_0496,Is stillborn macerated present?
test_0316,Is the gastric wall markedly thickened?
test_0456,"Does this image shows of smooth muscle cell with lipid in sarcoplasm and lipid show adrenal, metastatic gastric carcinoma, diffuse?"
test_0607,Is breast present?
test_0748,Is whipples disease present?
test_0969,Is cardiovascular present?
test_0540,"Does this image show kidney, obliterative endarteritis - sclerodema?"
test_0560,Is slide present?
test_0888,Does sebaceous cyst show skin?
test_0460,Does myocardium show fixed tissue but good color gland not recognizable as such?
